{
  "schema_version": 1,
  "observed_date": "2026-09-23",
  "scope": "core-managed-projects",
  "authority": {
    "registry_repository": "admin_nodove/document",
    "rule": "Repository-local source, status, and plan files remain authoritative; this registry stores only cross-project pointers and lifecycle metadata."
  },
  "archive_policy": {
    "default_action": "none",
    "require_all": [
      "canonical replacement is identified",
      "no open pull request requires the repository",
      "no deployment, CI, submodule, gitlink, or automation dependency requires the repository",
      "history and rollback evidence remain reachable",
      "archive is reviewed as a separate change"
    ],
    "delete_policy": "Do not delete as part of registry maintenance."
  },
  "projects": [
    {
      "id": "ai-server",
      "repository": "admin_nodove/AI-server",
      "role": "platform",
      "lifecycle": "active",
      "canonical": true,
      "last_observed_main": "9557084f691f4a9cf046471fdc70c693463392fc",
      "open_prs": [
        39,
        44
      ],
      "source_of_truth": [
        "AGENTS.md",
        "docs/operations/AI1_CURRENT_STATE.md",
        "plan/IMPLEMENTATION_STATUS_20260922.md"
      ],
      "status_note": "Current main includes PR43. PR39 remains conflicting UI-01c work; PR44 is a mergeable documentation/status update.",
      "relations": []
    },
    {
      "id": "ai-gateway",
      "repository": "admin_nodove/ai-gateway",
      "role": "platform",
      "lifecycle": "review",
      "canonical": false,
      "last_observed_main": "487660310ca57346a1ba0b3b4b9bda6001a3c0fb",
      "open_prs": [],
      "source_of_truth": [],
      "status_note": "Standalone TypeScript/Express gateway source with its own Compose. AI-server main consumes a published ai-server-gateway image rather than this repository path, so this repo is not the current ai-1 runtime authority. Published-image source/build provenance must still be proven before archival.",
      "relations": [
        {
          "project": "ai-server",
          "kind": "standalone-overlap-review",
          "state": "observed"
        }
      ]
    },
    {
      "id": "filamai",
      "repository": "admin_nodove/filamai",
      "role": "product",
      "lifecycle": "active",
      "canonical": true,
      "last_observed_main": "ccea539d162a52c69b0c3a3c3fdcc477c8c3495c",
      "open_prs": [
        3
      ],
      "source_of_truth": [
        "README.md",
        "CURRENT_STATE.md",
        "docs/PRODUCTION_READINESS_GATE.md"
      ],
      "status_note": "Workspace/meta repository pins authoritative backend/frontend submodules. Current release authority remains gated; PR3 publishes the latest unfinished plan.",
      "relations": []
    },
    {
      "id": "fcn",
      "repository": "admin_nodove/fcn",
      "role": "product",
      "lifecycle": "active",
      "canonical": true,
      "last_observed_main": "20a2e65aaadfedd63adb271b8fd418306f275fb7",
      "open_prs": [
        1,
        2
      ],
      "source_of_truth": [
        "README.md",
        "docs/IMPLEMENTATION_CONTRACT.md",
        "docs/REQUIREMENTS_COVERAGE.md"
      ],
      "status_note": "Twenty interactive product/UX concepts exist. Open work includes RFQ research and the latest unfinished-plan publication.",
      "relations": [
        {
          "project": "filamai",
          "kind": "reuse",
          "state": "planned"
        }
      ]
    },
    {
      "id": "wlatch-sessionloop",
      "repository": "admin_nodove/wlatch-sessionloop",
      "role": "runtime",
      "lifecycle": "active",
      "canonical": true,
      "last_observed_main": "b4d7ed45e72b8595f61dac6718618875e4914bc5",
      "open_prs": [
        6
      ],
      "source_of_truth": [
        "README.md",
        "SKILL.md"
      ],
      "status_note": "Runtime/transport hardening is established on main; PR6 publishes the latest unfinished WLatch plan.",
      "relations": []
    },
    {
      "id": "auto-career",
      "repository": "admin_nodove/auto-career",
      "role": "product",
      "lifecycle": "review",
      "canonical": true,
      "last_observed_main": "7ed08e85ae215c0d13c2b027546a1c4496c071a7",
      "open_prs": [],
      "source_of_truth": [
        "README.md",
        "pubspec.yaml"
      ],
      "status_note": "Flutter product and backend directory exist, but README remains Flutter boilerplate. Cross-project evidence/career ownership should be decided before expanding a parallel backend.",
      "relations": [
        {
          "project": "fcn",
          "kind": "reuse-candidate",
          "state": "proposed"
        }
      ]
    },
    {
      "id": "codex-chatgpt-web-main",
      "repository": "admin_nodove/codex-chatgpt-web-main",
      "role": "tooling",
      "lifecycle": "active",
      "canonical": true,
      "last_observed_main": "e736a1b113f767660fbff060f5e30cccb1c58bf5",
      "open_prs": [],
      "source_of_truth": [
        "README.md",
        "docs/architecture.md",
        "docs/security-model.md"
      ],
      "status_note": "Current source provides the browser bridge, full harness, dev harness, fail-closed model/UI behavior, and cross-platform launcher.",
      "relations": [
        {
          "project": "wlatch-sessionloop",
          "kind": "runtime-pattern",
          "state": "review"
        }
      ]
    },
    {
      "id": "community-refined-flutter",
      "repository": "admin_nodove/community-refined-flutter",
      "role": "product",
      "lifecycle": "review",
      "canonical": true,
      "last_observed_main": "97919af177cec138e10dad23427617eb44b4a954",
      "open_prs": [
        2
      ],
      "source_of_truth": [
        "README.md",
        "source/docs/design/refined/TASKS.md"
      ],
      "status_note": "Refined Flutter source package exists, but Flutter analyze/test/build and real-screen verification are explicitly not yet proven; PR2 publishes the latest unfinished plan.",
      "relations": [
        {
          "project": "filamai",
          "kind": "reuse-candidate",
          "state": "planned"
        },
        {
          "project": "fcn",
          "kind": "reuse-candidate",
          "state": "planned"
        }
      ]
    },
    {
      "id": "blog",
      "repository": "admin_nodove/blog",
      "role": "content-product",
      "lifecycle": "active",
      "canonical": true,
      "last_observed_main": "18a15e125de1fef563355c306ad72e32e049fee1",
      "open_prs": [
        1,
        3
      ],
      "source_of_truth": [],
      "status_note": "Current work includes a content update and latest unfinished-plan publication; shared docs/AI transport behavior must stay aligned with document where applicable.",
      "relations": [
        {
          "project": "document",
          "kind": "shared-behavior-review",
          "state": "planned"
        }
      ]
    },
    {
      "id": "writing",
      "repository": "admin_nodove/writing",
      "role": "content",
      "lifecycle": "active",
      "canonical": true,
      "open_prs": [],
      "source_of_truth": [],
      "status_note": "Canonical writing archive for blog posts, essays, drafts, and long-form originals.",
      "relations": [
        {
          "project": "blog",
          "kind": "content-source",
          "state": "observed"
        }
      ]
    },
    {
      "id": "document",
      "repository": "admin_nodove/document",
      "role": "content-platform",
      "lifecycle": "active",
      "canonical": true,
      "last_observed_main": "e1cfa987838167d55b20d8a45c103c97e8b4c64d",
      "open_prs": [
        1,
        2
      ],
      "source_of_truth": [
        "README.md",
        "plans/PROJECT_IMPLEMENTATION_REGISTRY_20260922.md"
      ],
      "status_note": "Docs Hub is the designated cross-project registry home. PR1 hardens AI transport; PR2 carries this cross-project registry.",
      "relations": []
    },
    {
      "id": "media-mcp",
      "repository": "nodove/media-mcp",
      "role": "service",
      "lifecycle": "active",
      "canonical": true,
      "last_observed_main": "5c5db69a03e407bb0b2bbf81fcbb48c409cda87a",
      "open_prs": [
        1,
        2,
        3,
        4,
        5
      ],
      "source_of_truth": [
        "README.md"
      ],
      "status_note": "Compose-based media stack is the verified baseline. Five open YTS automation PRs form a cumulative implementation sequence and should be treated as stacked work.",
      "relations": []
    },
    {
      "id": "helm",
      "repository": "admin_nodove/helm",
      "role": "infrastructure",
      "lifecycle": "review",
      "canonical": false,
      "last_observed_main": "b3ecce74a3c5feaac9165fcabe7db27775996ccd",
      "open_prs": [],
      "source_of_truth": [],
      "status_note": "Main tree is empty. Decide whether this is the future Helm source of truth or a placeholder before adding deployment logic.",
      "relations": []
    }
  ]
}
